lodging_url,name,author,date_since,airbnb_url,gmap_url,address,city,state,zip,area,country,last_update,property_id,price,bedroom,rooms,bathrooms,garage,property_type,property_status,guest_number,description
https://www.bukitvista.com/property/uluwatu-modern-boho-villa-near-nyang-nyang-beach-2,Uluwatu Modern Boho Villa Near Nyang Nyang Beach,Agus Weda,1 month ago,https://www.airbnb.com/rooms/1287975372353817564,,,,,,,,,,,,,,,,,,
https://www.bukitvista.com/property/bingin-beach-hideaway-group-villa-with-pool-amp-bbq,Bingin Beach Hideaway: Group Villa with Pool & BBQ,Bukit Vista,1 month ago,https://www.airbnb.com/rooms/1201807361024443576,"http://maps.google.com/?q=Jl.%20Pantai%20Cemongkak%20Gg.%20Samuh%20Sari%20No.2,%20Pecatu,%20Kec.%20Kuta%20Sel.,%20Kabupaten%20Badung,%20Bali%2080361","Jl. Pantai Cemongkak Gg. Samuh Sari No.2, Pecatu, Kec. Kuta Sel., Kabupaten Badung, Bali",Bali,Bali,80361,Bingin,Indonesia,"Updated on February 8, 2025 at 10:49 am",PR0874,Starting from USD 161 per night,3,3,3,1,"Amazing pool, Island life, Pool view, Surfing, Tropical, Villa","Bali Vacation Rental, Group Friendly Stay, Long Stay Trend Property, New Listing, Private, Private Pool, Top Trending",6,"About this space Nestled in the heart of Bingin, this tropical 3-bedroom villa is the perfect family vacation spot. Designed for comfort and relaxation. Located just a 6-minute drive from the beautiful Bingin Beach, this villa offers the ultimate blend of luxury and convenience for your next getaway. Key Features: – Bedrooms with an ensuite bathroom and AC – Fully equipped kitchen – Private pool – Outdoor gathering space w/ BBQ grill – Dedicated workspace on the mezzanine – Balcony w/ stunning sunset view The space Experience a Bali retreat curated by Bukit Vista, where thoughtful design meets heartfelt hospitality. This 3-bedroom villa, just steps from Bingin Beach, is your sanctuary for family bonding and group adventures. Every detail, from the BBQ-ready outdoor space to tailored recommendations like dining at Gooseberry Restaurant or watching the sunset at El Kabron Bali, reflects Bukit Vista’s dedication to exceptional stays. With our team’s attentive support—helping you find hidden gems and local highlights—your getaway will be seamless, comfortable, and filled with cherished memories. Let Bukit Vista turn your Bali vacation into an unforgettable experience. • BEDROOMS The villa offers three spacious bedrooms, with one conveniently located downstairs and two upstairs. Each room features a luxurious king-size bed and its own private ensuite bathroom, ensuring comfort, privacy, and a restful night’s sleep. • BATHROOMS The villa boasts modern ensuite bathrooms attached to each bedroom, providing a comfortable and private experience for all guests. • LIVING ROOM The cozy living room is the perfect place to unwind, complete with a Netflix-enabled TV and ample seating, making it an ideal spot for family movie nights or relaxing after a day of adventure. • PRIVATE POOL Enjoy a refreshing swim or lounge poolside, soaking up the tropical ambiance in complete privacy. Pool lights are automatically on from 6 PM to 10 PM to minimize energy usage. • FULLY EQUIPPED KITCHEN The kitchen is fully equipped with modern appliances and everything you need to prepare delicious meals during your stay. • OUTDOOR Enjoy the villa’s inviting outdoor area, featuring a BBQ patio perfect for family cookouts and a fire pit with bean bags to relax and chill. • WIFI Stay connected with the villa’s WiFi, offering speeds of around 93 Mbps. While speeds may vary depending on usage, the connection ensures you can keep in touch with the outside world or stream your favorite shows with ease. • NEARBY LOCATIONS Cafe & Eateries – 4 mins ride or 1.1 km to Gooseberry Restaurant – 6 mins ride or 1.2 km to The Cashew Tree – 6 mins ride or 1.6 km to DiVino by Casa Asia – 7 mins ride or 2.1 km to Drifter Surf Shop Cafe – 7 mins ride or 2.2 km to Hatch, Bar & Restaurant Beach & Beach Club: – 4 mins ride or 1.1 km to El Kabron Bali – 4 mins ride or 1.6 km to Cemongkak Beach – 7 mins ride or 1.4 km to Bingin Beach – 9 mins ride or 3.2 km to Padang Padang Beach – 15 mins ride or 5.2 km to Uluwatu Beach ATMs – 7 mins ride or 2.2 km to ATM Maybank Wana Mart – 8 mins ride or 2.9 km to ATM Commonwealth Bank Convenience store – 4 mins ride or 1.2 km to Corner mart – 7 mins ride or 2.3 km to Island Foods – 7 mins ride or 2.2 km to Wana Mart Pharmacy – 8 mins ride or 2.8 km to Apotek Mata Harii – 14 mins ride or 5.1 km to Apotek Pharmacy Gym – 6 mins ride or 1.6 km to Bambu Fitness Bali Connectivity – 7 mins ride or 2.1 km to Sim Card Telkomsel Padang Padang Laundromat – 13 mins ride or 5.5 km to DOM Laundry & Dry Cleaning Guest access Guests have full access to the entire villa, including the private pool, outdoor gathering area, patio with BBQ setup, and balcony with stunning views. • PARKING AREA Free parking is available on the premises, ensuring a hassle-free experience for guests with vehicles. The space can accommodate up to 6 bikes or 1 SUV. Other things to note ★EXCLUSIVE PARTNERSHIP★ ☑ LEMANJÁ ULUWATU RESTAURANT Enjoy special offers with your valid booking ID: – 15% off for dine-in guests – 10% off for delivery orders – 10% off for floating breakfast (order at least one day in advance) Discounts cannot be combined. Simply show your booking ID and savor the flavors of Bali! ☑ ROLLING FORK As a token of our appreciation, we invite our guests to enjoy a unique offer: 10% off your bill at Rolling Fork. Simply show your booking ID and indulge in the flavors of Bali at a fraction of the cost. Additionally, for your convenience, you can contact us to order your food, and we will ask to deliver it to you. Please note, that service will incur an extra charge, ensuring your utmost comfort and satisfaction. ☑ THE CASHEW TREE Get a 10% Discount: Guests with a valid booking ID are entitled to a 10% discount at The Cashew Tree! Simply present your booking ID and delight in the authentic tastes of Bali in a laid-back, tropical atmosphere. ★ ELEVATE YOUR STAY WITH OUR EXCLUSIVE, PREMIUM SERVICES ★ – Tranquil Spa Services Dive into serenity with our relaxing and rejuvenating spa treatments, crafted to soothe your soul and pamper your body. – Premium Alcohol Selections Toast to memorable moments with our curated selection of premium spirits and wines. – Personalized City Drive Tour Explore the city’s breathtaking landmarks on a private tour, customized just for you. – Romantic Room Decoration Surprise your partner with a specially tailored romantic setup, perfect for celebrating those unforgettable occasions. – Customized Working Setup Design your ideal productivity space with our tailored working setup, ensuring you stay productive and inspired. To secure your exclusive experiences, please reach out through Airbnb chat at least one day (D-1) in advance. This allows us to tailor each offering to your preferences, ensuring your stay is as unique and memorable as possible. Please note, these handpicked premium offerings are available for an additional charge. • SCOOTER RENT If you’d like to rent a scooter, we can assist you with that. Please let us know at least one day in advance. Scooter rental rates are typically between IDR 100K to IDR 150K per day per scooter. • CLEANING We offer cleaning services for your convenience. If you prefer daily cleaning, we will do our best to accommodate your request based on staff availability. Please contact us if you need daily cleaning services. • NOT PET-FRIENDLY We want to inform you that we do not allow pets on this property. • AIR CONDITIONER Please be note that although our air conditioning system is fully functional, the villa’s extensive use of glass may lead to somewhat elevated indoor temperatures. We value your comfort and understanding, and are committed to ensuring a pleasant stay for you. • AIRPORT PICK-UP SERVICE We are 50 minutes – 1 hour (20 km) from the airport. We can assist you in providing an airport pick-up service at the cost of IDR 325K (around USD 22) per car. • CHECK-IN POLICY Basic Rules: Standard Check-in: 15:00 (STRICT) Standard Check-out: 11:00 (STRICT) – Early Check-In Time We do not accept or accommodate any early check-ins. Please plan your arrival accordingly, as we cannot offer early check-in or luggage drop-off services. – Late Check-In Time For a smooth and safe arrival, we recommend that you check in by 5 PM at the latest, especially considering the dark areas after sunset which might be challenging. Our online hosts are available from 9 AM to 6 PM to assist you. Kindly provide us with your estimated arrival time at least one day in advance (D-1) so we can assist you better. • LEAVING LUGGAGE POLICY: – Check-in: You cannot leave your luggage before the check-in time. – Check-out: After check-out time, if you wish to store luggage only, please inform us. We will then check staff availability and let you know if it’s possible. CHECK-OUT POLICY Our check-out time is STRICT adhering to our checkout time. We do not accept or accommodate any late check-outs. Please plan your departure accordingly. • PAYMENT METHOD We prefer to make a reservation on Airbnb. Airbnb accepts the following payment methods: Credit Card. If you don’t have a credit card, you can apply for an electronic card issued by banks like: – JENIUS by BTPN (Indonesia) – DIGIBANK by DBS • NO VISITATION Airbnb policy states that we cannot do a site visit before the booking is confirmed for safety reasons. The exact address, directions, and details of the property will be given after you book the property. • CONSTRUCTION A new project nearby is underway, wrapping up by May 2025, with work from 8 AM to 5 PM. Bring earplugs or take the chance to explore—grab a bite at The Cashew Tree, catch sunsets at Bingin Beach, or hit a local gym. Book Now on Airbnb"
https://www.bukitvista.com/property/mediterranean-luxury-villa-ubud-rooftop,4-Bedroom Mediterranean Luxury Villa with Ubud Rooftop View,Bukit Vista,1 month ago,https://www.airbnb.com/rooms/1338046513545783704,"http://maps.google.com/?q=Jl.%20Suweta,%20Ubud,%20Kecamatan%20Ubud,%20Kabupaten%20Gianyar,%20Bali%2080571","Jl. Suweta, Ubud, Kecamatan Ubud, Kabupaten Gianyar, Bali",Bali,Bali,80571,Ubud,Indonesia,"Updated on February 7, 2025 at 4:31 pm",PR0960,USD 202 / Night,4,4,4,1,"Amazing pool, Amazing View, Jungle View, Pool view, Tropical, Villa","Bali Vacation Rental, Group Friendly Stay, Instagramable Stay, Long Stay Trend Property, Private, Private Pool, Top Trending",8,"Experience the perfect blend of modern elegance and tropical charm at this Mediterranean Luxury Villa in the heart of Ubud . Featuring a private pool , scenic jungle view from the rooftop, and beautifully designed interiors, this serene retreat is ideal for families and groups. Nestled close to Ubud’s iconic rice terraces and cultural landmarks, it’s the ultimate escape for relaxation and adventure. Experience the perfect blend of modern elegance and tropical charm at this 4-bedroom villa in the heart of Ubud . Featuring a private pool , scenic rooftop views, and beautifully designed interiors, this serene retreat is ideal for families and groups. Nestled close to Ubud’s iconic rice terraces and cultural landmarks, it’s the ultimate escape for relaxation and adventure. Features: – King-sized bed w/ AC – Private pool – Fully equipped kitchen – Rooftop w/ breathtaking views – High-speed Wi-Fi The space Welcome to your private oasis in Ubud, a 4-bedroom villa managed by Bukit Vista, ensuring top-notch hospitality and seamless services. Spanning across a beautifully designed space, this villa offers a serene escape while being close to Ubud’s cultural hotspots. Perfectly suited for families and groups of up to 8 people, the villa boasts thoughtfully designed spaces that prioritize comfort and style. Whether you’re here for a tranquil retreat or a cultural exploration, this villa is your ideal sanctuary. Getting around Ubud is easy with a scooter, which we can arrange for you. Explore nearby waterfalls, cultural landmarks, and charming cafes with ease. LIVING AREA A Mediterranean-inspired sanctuary with natural textures, arched accents, and warm earthy tones. Floor-to-ceiling glass doors open up to stunning jungle views, creating an inviting atmosphere for relaxation or entertaining. The living area is equipped with air conditioning for added comfort, and a projector with a smart TV is installed for an enhanced entertainment experience. BEDROOMS Each of the four stylish bedrooms features a king-size bed, rattan furnishings, and soft neutral palettes that exude coastal charm. Large windows invite natural light and offer breathtaking views of Ubud’s lush greenery. For added privacy and convenience, each bedroom comes with its own ensuite bathroom. POOL AREA The private pool is an oasis of tranquility, framed by sleek travertine stone and lush greenery. Built-in lounge seating, a cozy hammock, and elegant sconces enhance the Mediterranean ambiance, making it perfect for unwinding under the Bali sun. KITCHEN & DINING A fully equipped kitchen with open shelving, natural stone countertops, and high-end appliances. The rustic wooden dining table provides an intimate space for shared meals in a warm, inviting setting. ROOFTOP The rooftop is a serene escape designed for both relaxation and entertainment, overlooking breathtaking jungle views. Equipped with BBQ utensils, it’s perfect for hosting sunset gatherings with friends or family. Unwind on the sun loungers, stargaze through the telescope, or challenge your companions to a game of chess in the cozy seating area. This versatile space offers the perfect blend of comfort and leisure, all set against a stunning natural backdrop. WI-FI AND CONNECTIVITY Stay connected with high-speed Wi-Fi, offering impressive speeds of 95.1 Mbps for downloads and 126 Mbps for uploads. This connection is ideal for streaming, remote work, video conferencing, and staying in touch with loved ones. Please note that Wi-Fi speed may vary depending on the number of users and network traffic. NEARBY LOCATIONS RESTAURANTS: The Raw Temple: Vegan & Vegetarian Restaurant – 1 minutes walk or 78 m Cocoku Ubud Restaurant – 4 minutes walk or 240 m Cafe Bintang Japanese Restaurant – 7 minutes walk or 450 m Kasaba Restaurant – 6 minutes ride or 2.1 km Locavore Ubud – 10 minute ride or 3.4 km TOURIST ATTRACTION Ubud Palace – 6 minutes ride or 2.8 km Taman Kemuda Saraswati Temple – 7 minutes ride or 2.9 km Sacred Monkey Forest Sanctuary – 16 minutes ride or 4.7 km CAFE: Heart Bean Cafe Ubud – 5 minutes ride or 1.9 km Maniztutu Coffe & Eatery – 5 minutes ride or 2.0 km Watercress Cafe – 11 minutes ride or 3.5 km Clear Cafe – 11 minutes ride or 3.6 km ATM: ATM Bank OCBC – 9 minutes ride or 3 km Mandiri ATM – 9 minutes ride or 3 km ATM Bank BCA 2426 – 8 minutes ride or 3.5 km Maybank ATM – 9 minutes ride or 3.6 km LAUNDROMAT: Nani Laundry – 1 minutes ride or 400 m LA FRONDS Laundry & Co – 4 minutes ride or 1.7 km CONVENIENCE STORE: M Mart – 2 minutes ride or 800 m Indomaret Suweta – 6 minutes ride or 2.4 km Circle K Sriwedari Ubud – 7 minutes ride or 2.5 km PHARMACY: Guardian Pharmacy – 10 minutes ride or 3.1 km Apotek Kimia Farma Ubud Raya – 7 minutes ride or 3.2 km Guest access Guests have full access to the entire villa, including the private pool, rooftop, and car parking area. Our team is available 24/7 to assist you during your stay. PARKING AREA The villa offers ample private car parking space, making it convenient for guests traveling with a vehicle. Other things to note 🌟 Exclusive Benefits for Bukit Vista Guests at K-Club Ubud 🌴 Kabana by K-Club Ubud – Free entry to restaurant and party scene. – Complimentary welcome drink upon arrival. 🍷 Akar Restaurant by K-Club Ubud – Groups of 1-3: Free Sparkling Wine or Signature Cocktail per person. – Groups of 4+: Free bottle of Sparkling Wine for the table. Enjoy Ubud’s finest dining and entertainment! Show your name and booking ID to claim these exclusive Bukit Vista perks. DROP-IN YOGA CLASS Discover your inner peace and rejuvenate your body with our Drop-In Yoga Classes at the Bali Yoga Center. * Morning: 7:30 AM – 9:00 AM * Evening: 4:15 PM – 5:45 PM * Price: IDR 150K per visit Join us to experience the transformative power of yoga in a supportive community. SCOOTER RENT Our onsite team can assist with scooter rentals at IDR 100K – 200K per day, including helmets. Riding a scooter is the best way to explore Ubud’s scenic roads and hidden gems. CLEANING Enjoy daily cleaning services for a hassle-free stay. If you prefer privacy on certain days, simply inform our team. AIRPORT PICK-UP SERVICE We provide airport transfer services from Ngurah Rai International Airport at a rate of Rp. 500,000 per trip for a hassle-free arrival. CHECK-IN POLICY ◦ Early Check-in We do not accept or accommodate any early check-ins. Please plan your arrival accordingly, as we cannot offer early check-in or luggage drop-off services. ◦ Late Night Check-in For a smooth and safe arrival, we recommend that you check in by 5 PM at the latest, especially considering the dark areas after sunset which might be challenging. Our online hosts are available from 9 AM to 6 PM to assist you. ◦ Late Check-out Our check-out time is STRICT adhering to our checkout time at 11 AM. We do not accept or accommodate any late check-outs. Please plan your departure accordingly. NO LUGGAGE DROP-OFF We do not provide luggage storage before check-in or after check-out. ACCESS INFORMATION AND CONTACT DETAILS Once your booking is confirmed, you’ll receive the exact address, directions via Google Maps, and our team’s contact details to ensure a smooth arrival. PAYMENT METHOD We prefer to make a reservation on Airbnb . Airbnb accepts the following payment method: Credit Card. If you don’t have a credit card, you can apply for an electronic card issued by banks like: – Jenius by BTPN (Indonesia) – Digibank by DBS Book Now on Airbnb"
