lodging_url,name,author,date_since,airbnb_url,gmap_url,address,city,state,zip,area,country,last_update,property_id,price,bedroom,rooms,bathrooms,garage,property_type,property_status,guest_number,description
https://www.bukitvista.com/property/dazzling-villa-with-pool-and-rooftop-in-bingin,Dazzling Villa with Pool and Rooftop in Bingin,Bukit Vista,5 months ago,https://www.airbnb.com/rooms/1035769871062218759/details/photo-tour,,"Pecatu, South Kuta, Badung Regency, Bali",Bali,Bali,80361,Bingin,Indonesia,"Updated on October 3, 2024 at 3:43 pm",PR0803,Starting from USD 202 per night,2,,2,,Villa,"New Listing, Top Trending",4,"About this space Nestled in the heart of a serene coastal enclave, our villa is perfectly located just an 8-minute drive from the golden sands and surf-ready waves, Bingin Beach. This ideal location offers a peaceful retreat away from the hustle and bustle, yet is conveniently close to some of Bali’s most scenic spots. Features: – Two bedrooms with king-size bed – Fully equipped kitchen – Private pool – Rooftop with plunge pool The space Discover the delight of upscale living in Bingin where our villa’s design is minimalist yet cozy interiors are complemented by wooden accents and a calming color scheme, inviting you to unwind in style. For your convenience, our villa is situated about 1 km from the main road, Jalan Labuansait. Don’t worry about missing out on local attractions—we provide curated recommendations for you to explore and enjoy during your stay, ensuring you make the most of your visit. • ROOM ARRANGEMENT Two bedrooms with king-size beds each boasting plush linens, ample storage, and sleek. The upstairs bedroom had an en-suite bathroom for your ultimate comfort. • POOL Your personal oasis awaits in the form of a clear, inviting pool, set against the backdrop of a tropical garden, complete with a sun lounger for idyllic relaxation. • KITCHEN The kitchen is well-equipped to satisfy your culinary cravings, providing the ideal setting to craft a meal tailored to your tastes. It’s a canvas for expressing both your creativity and love for good food. Present your culinary masterpieces on the dining table and relish them in the company of friends. • WIFI SPEED We provide Free Wi-Fi with speeds up to 89 Mbps. Please note that Wi-Fi speeds may vary based on the number of users and weather conditions. • NO EXTRA BED Our villa is designed to embrace the coziness of the available space, hence we do not offer extra beds to ensure each guest enjoys the comfort of their stay. • SURFING AND BEACHES Bingin, located on Bali’s southwestern coast, is a surfer’s paradise, known for its great waves and stunning cliffs. Nearby beaches like Padang Padang, Dreamland, and Uluwatu cater to surfers of all levels and those who wish to relax on white sandy beaches and enjoy clear waters. • LOCAL CULTURE AND DINING This area combines a laid-back surf culture with a vibrant bohemian vibe. Enjoy the local flavors at charming cafes and warungs along the beachfront, perfect for savoring the stunning sunsets. Notable dining spots like Gooseberry or Mason offer everything from casual to exquisite dining experiences. • NIGHTLIFE AND EVENING EXPERIENCE As night falls, Bingin offers a wealth of exciting experiences. From lively party scenes at Balinese hotspots like El Kabron, Ulu Cliffhouse, Savaya, and Single Fin to serene evening settings for a romantic dinner or an informal beach BBQ, there’s something for everyone. Live music venues are also available for those seeking entertainment. • BALI SCOOTER RENTALS Experience the best of Bali at your own pace with Yaya and Twin Scooter Rental. Perfect for navigating local streets and small alleys, these motorbikes offer a hassle-free way to avoid traffic and easily find parking. Enjoy professional service with convenient pick-up and drop-off, and ride confidently with well-maintained equipment. Ready to explore more and make your Bali holiday unforgettable? Contact us today to book your scooter! • GALUNGAN & KUNINGAN SPECIAL DISCOUNT Enjoy a discounted stay from Sept 24-26, 2024 during the Galungan festival, and from Oct 4-5, 2024 for Kuningan. As our team joins the local festivities, no in-house cleaning will be available during both periods, offering you complete privacy to relax and enjoy a tranquil stay. Immerse yourself in Bali’s rich culture while experiencing some of the island’s most beautiful celebrations. • NEARBY LOCATIONS BEACH: – Bingin Beach: 2.4 km or an 8-minute drive – Cemongkak Beach: 2.7 km or an 8-minute drive – Padang Padang Beach: 3.4 km or a 9-minute drive – Uluwatu Beach: 5.4 km or a 14-minute drive HANGOUT & EATERY: – The Cashew Tree: 2.3 km or a 6-minute drive – DiVino by Casa Asia: 2.5 km or a 6-minute drive – El Kabron: 2.5 km or a 7-minute drive – Gooseberry Restaurant: 2.6 km or a 7-minute drive – YUKI Uluwatu: 4.8 km or an 11-minute drive – MASON Bar: 5.0 km or an 11-minute drive – Single Fin Bali: 5.4 km or a 13-minute drive OTHER: – Maybank ATM: 3.4 km or an 8-minute drive – SIM Card Telkomsel Padang Padang: 2.0 km or a 6-minute drive – Jaya Gym Uluwatu: 2.6 km or a 7-minute drive – Md Laundry: 1.3 km or a 4-minute drive – Made Printing: 2.1 km or a 6-minute drive – Island Food (Grocery Mart): 2.1 km or a 6-minute drive Guest access Guests are invited to enjoy full access to the entire property, ensuring privacy and exclusivity during their stay. The home, pool, and all its facilities are at your disposal for a truly personal retreat. • PARKING AREA You can park your scooter in front of the villa. If you bring a car you can park it next to the villa which is enough for one car. • NO BREAKFAST Guests can take pleasure in the self-catering facilities as breakfast is not included. The nearby Bingin culinary scene also presents a variety of breakfast options to savor. • NO PET ALLOWED To maintain the pristine environment of the home, we regret that pets are not permitted. Other things to note ★ Elevate Your Stay with Our Exclusive, Premium Services ★ – Exclusive 10% Dining Discount at Rolling Fork: Delight in the city’s exquisite flavors for less—just present your valid Booking ID. – Tranquil Spa Services: Dive into serenity with our relaxing and rejuvenating spa treatments, crafted to soothe your soul and pamper your body. – Premium Alcohol Selections: Toast to memorable moments with our curated selection of premium spirits and wines. – Personalized City Drive Tour: Explore the city’s breathtaking landmarks on a private tour, customized just for you. – Romantic Room Decoration: Surprise your partner with a specially tailored romantic setup, perfect for celebrating those unforgettable occasions. – Customized Working Setup: Design your ideal productivity space with our tailored working setup, ensuring you stay productive and inspired. – Ready to Enhance Your Stay? To secure your exclusive experiences, please reach out through Airbnb chat at least one day (D-1) in advance. This allows us to tailor each offering to your preferences, ensuring your stay is as unique and memorable as possible. Please note, these handpicked premium offerings are available for an additional charge. • EXCLUSIVE OFFER FOR BUKIT VISTA GUESTS Get a 10% Discount at The Cashew Tree Bingin! Show your booking ID and savor the flavors of Bali at an exclusive rate. • SCOOTER RENT If you’d like to rent a scooter, we can assist you with that. Please let us know at least one day in advance. Scooter rental rates are typically between IDR 100K to IDR 150K per day per scooter. • RIDE-HAILING SERVICES Please note that Gojek ride-hailing services are currently unavailable at our property. However, Grab services are available for your transportation needs. Please make sure to use the name on google maps when searching the property. • CLEANING We offer cleaning services for your convenience. If you prefer daily cleaning, we will do our best to accommodate your request based on staff availability. Please contact us if you need daily cleaning services. • AIRPORT PICK-UP SERVICE We are 35–45 minutes from the airport. We can assist you in providing an airport pick-up service at the cost of IDR 325K (around USD 21) per car. • CHECK-IN POLICY Basic Rules: Standard Check-in: 14:00 (STRICT) Standard Check-out: 12:00 (STRICT) • EARLY CHECK-IN We do not accept or accommodate any early check-ins. Please plan your arrival accordingly, as we cannot offer early check-in or luggage drop-off services. • LATE NIGHT CHECK-IN For a smooth and safe arrival, we recommend checking in by 5 PM at the latest, especially considering the dark areas after sunset which might pose challenges. Our online hosts are available from 9 AM to 6 PM to assist you. Kindly provide us with your estimated arrival time at least one day in advance (D-1) so we can assist you better. • LATE CHECK-OUT Our check-out time is STRICTLY 12 PM. We do not accept or accommodate any late check-outs. Please plan your departure accordingly. • LEAVING LUGGAGE POLICY: – Check-in: You cannot leave your luggage before the check-in time. – Check-out: After check-out time, if you wish to store luggage only, please inform us. We will then check staff availability and let you know if it’s possible. • PAYMENT METHOD We prefer to make a reservation on Airbnb. Airbnb accepts the following payment methods: Credit Card. If you don’t have a credit card, you can apply for an electronic card issued by banks like: – JENIUS by BTPN (Indonesia) – DIGIBANK by DBS • NO VISITATION Airbnb policy states that we cannot do a site visit before the booking is confirmed for safety reasons. The exact address, directions, and details of the property will be given after you book the property. • CONSTRUCTION Please note, significant construction activity near our property occurs from 8 AM to 5 PM, potentially extending to 10 PM on certain days due to work demands. The construction is estimated to be done by December 2024 While we aim to ensure your comfort, noise will be noticeable. Consider using earplugs or a noise mask for a better stay. We appreciate your understanding and will inform you when construction ends. View On Airbnb Villa in Bingin, Kuta Selatan · ★4.79 · 2 bedrooms · 2 beds · 2 baths Book Now on Airbnb"
https://www.bukitvista.com/property/sun-soaked-2br-villa-w-pool-15-min-ride-to-beach,Sun-Soaked 2BR Villa w/ Pool 15-Min Ride to Beach,Bukit Vista,6 months ago,https://www.airbnb.com/rooms/1238113021006503793?guests=1&adults=1&s=67&unique_share_id=72a6b508-b8c2-44c9-8db4-59ca6179ba50,"http://maps.google.com/?q=Denpasar,%20Bali,%20Nusa%20Tenggara,%20Indonesia",Jalan Toya Ning II No.1,Bali,Bali,,Canggu,Indonesia,"Updated on January 9, 2025 at 11:59 am",PR0921,Starting from USD 91 per night,2,,2,,Villa,"Bali Vacation Rental, Good Deal",4,"About this space 100% Balinese owned – Authentic Stay with Locals Enjoy a serene Balinese retreat in Ungasan, owned by a local Balinese family. This stylish villa blends traditional charm with modern comfort, ideal for groups. Relax by the pool, visit stunning nearby beaches, or explore local dining gems. Every detail reflects Balinese culture, offering a truly memorable stay. Features: 2 Bedrooms with king-sized beds Ensuite bathrooms Smart TV with a Netflix account ready. Fully equipped kitchen The space As you enter the property, you’ll be greeted by a spacious outdoor area featuring a private pool and sun loungers. The outdoor space is perfect for taking a refreshing dip or relaxing after a day of exploring the lively surroundings of Ungasan. This villa is perfect for groups looking for comfort and a convenient location to explore Bali. With two spacious bedrooms, a private pool, and a comfortable living space, it offers a great base to enjoy the vibrant local area while having all the amenities needed for a relaxing stay. LIVING AREA The living, dining, and kitchen areas are enclosed in a single air-conditioned room, offering a cozy retreat from the outside. The living space includes comfortable seating and a flat-screen TV, making it ideal for relaxing with your group. Large windows allow plenty of natural light to brighten the room. BEDROOMS Both bedrooms are designed for rest and relaxation, featuring king-sized beds, air conditioning, and ample storage. Each room opens directly to the pool area, providing easy access to the outdoor space while still ensuring privacy. POOL AREA The private pool is the highlight of the outdoor area, offering a cool and inviting spot to swim or lounge in the sun. Sunbeds are available for guests to unwind, while the tropical garden adds a touch of greenery to the surroundings. KITCHEN AND DINING AREA The modern kitchen is equipped with a refrigerator, stovetop, rice cooker, and essential utensils, perfect for preparing meals during your stay. The dining area is integrated into the living space and comfortably seats four, providing a great spot for group meals. GALUNGAN & KUNINGAN SPECIAL DISCOUNT Enjoy a discounted stay from Sept 24-26, 2024 during the Galungan festival, and from Oct 4-5, 2024 for Kuningan. As our team joins the local festivities, no in-house cleaning will be available during both periods, offering you complete privacy to relax and enjoy a tranquil stay. Immerse yourself in Bali’s rich culture while experiencing some of the island’s most beautiful celebrations. NEARBY LOCATIONS: Lunch and Dinner Experiences: El Merkat Bali: 1.1 km or 2 mins ride. ANDE Café & More: 550 m or 1 min ride. Ohana Bali Restaurant, Bar & Kidsparadise: 600 m or 2 mins ride. Convenience Store: Circle K Pecatu Utara: 600 m or 1 min ride. Pepito Express Pecatu: 1.7 km or 4 mins ride. Beach Outings: Green Bowl Beach: 4.8 km or 11 mins ride. Melasti Beach: 5.5 km or 12 mins ride. Pandawa Beach: 7.5 km or 16 mins ride. Hangouts: Tarrabelle: 1.5 km or a 3 mins ride. Mïnoo Beach Club: 5.4 km or 11 mins ride. Sundays Beach Club: 4.2 km or 11 mins ride. Savaya: 3.8 km or 11 mins ride. White Rock Beach Club: 4 km or 11 mins ride. Tourist Attractions: Garuda Wisnu Kencana Cultural Park: 3.8 km or 14 mins ride. Uluwatu Temple: 7.6 km or 14 mins ride. Gym: DFC GYM: 2.3 km or a 6 mins ride. Fitness Plus Uluwatu: 1.9 km or 5 mins ride. Others: Apotek OMSA (pharmacy): 550 m or 1 min ride. Apotek Calvaria Dewata (pharmacy): 800 m or 2 mins ride. BCA ATM: 1.1 km or 2 mins ride. ATM BNI SPBU Ungasan: 1.5 km or a 4 mins ride. Cahaya 2 Cell: 1 km or 2 mins ride. New Kuta Golf Bali: 3.7 km or 7 mins ride. Guest access Guests have full access to the entire villa, including the private pool, kitchen, pool, and dining area. Enjoy complete privacy throughout your stay. PARKING AREA The villa offers parking area for guests, with easy access for cars and scooters. Other things to note ROAD NOISE NOTICE The villa is located near the main road, so there may be some traffic noise. However, this makes it easy to explore nearby beaches, restaurants, and attractions. For light sleepers, we suggest bringing earplugs. SCOOTER RENT Our onsite team can help you with scooter rental. It usually costs around IDR 100K – 200K per day without petrol, including 2 helmets. CLEANING We offer daily cleaning services for your convenience. If there is a day that you do not want cleaning, please let us know. AIRPORT PICK-UP SERVICE We are 35 – 45 minutes from the airport. We can assist you in providing an airport pick-up service at the cost around IDR 325K (around USD 21) per car. CHECK-IN POLICY EARLY CHECK-IN: We do not accept or accommodate any early check-ins. Please plan your arrival accordingly, as we cannot offer early check-in or luggage drop-off services. LATE NIGHT CHECK-IN: For a smooth and safe arrival, we recommend that you check in before 8 PM, especially considering the dark areas after sunset which might be challenging. Our online hosts are available from 9 AM to 6 PM to assist you. LATE CHECK-OUT: Our check-out time is STRICT adhering to our checkout time. We do not accept or accommodate any late check-outs. Please plan your departure accordingly. AIRBNB POLICY Airbnb Policy states that you can’t contact us directly if you haven’t booked yet. PAYMENT METHOD We prefer to take reservations on Airbnb. Airbnb accept payment method using Credit Card If you don’t have a credit card, you can apply for an electronic card issued by banks like: Jenius by BTPN (Indonesia) Digibank by DBS View On Airbnb Villa in Kecamatan Kuta Selatan · ★New · 2 bedrooms · 2 beds · 2 baths Book Now on Airbnb"
https://www.bukitvista.com/property/voguish-penthouse-with-rooftop-pool-near-canggu,Voguish Penthouse with Rooftop Pool Near Canggu,Bukit Vista,6 months ago,https://www.airbnb.com/rooms/1246783202978808833?guests=1&adults=1&s=67&unique_share_id=7dd69d40-985d-4cdb-8e76-ff41cc5ae2b9,"http://maps.google.com/?q=Denpasar,%20Bali,%20Nusa%20Tenggara,%20Indonesia",Jl. Canggu Permai Gg. Rajawali,Bali,Bali,,Canggu,Indonesia,"Updated on September 27, 2024 at 5:48 pm",PR0929,Starting from USD 89 per night,2,,2,,Villa,"New Listing, Top Trending",4,"About this space Welcome to your stylish penthouse in Berawa, just minutes from Central Canggu! Perfect for adventurous travelers, this spacious 3rd-floor property offers great views from both the living area and the private rooftop pool. With cafes, beaches, and nightlife nearby, it’s the ideal spot for your Bali getaway, whether you want to relax or explore! Features: Two bedrooms with king-sized beds with AC Ensuite bathrooms Private rooftop pool Fully equipped kitchen Fast Wi-Fi The space This beautifully designed penthouse is perfect for those seeking a modern and peaceful escape. Located in Berawa, just on the edge of the bustling Canggu area, it allows easy access to both the serene environment and the vibrant social scene of Canggu. The penthouse is on the 3rd floor, giving guests a quiet, elevated experience away from the busy streets below. This penthouse offers a modern space with all the amenities needed for a memorable Bali vacation. With a rooftop pool, stylish living areas, and a strategic location in Berawa, you’ll enjoy the best of both worlds – peace and quiet, and easy access to Central Canggu. LIVING AREA The living area is spacious and open, featuring a large, comfy sofa facing panoramic windows. The natural light floods the room, making it a perfect place to relax after a day of exploring. It’s also equipped with a TV for entertainment. BEDROOMS In the bedroom area, you’ll find two elegant bedrooms, each with king-sized beds, air conditioning, and ensuite bathrooms. The bedrooms are thoughtfully designed with cozy linens and soft lighting to create a peaceful atmosphere. POOL The pool area is the standout feature of the property. A private rooftop pool offers a serene spot to take in the stunning views, especially during Bali’s famous sunsets. The pool deck also has comfortable seating to lounge and soak up the sun. KITCHEN The kitchen is fully equipped with everything you need for cooking. It includes a refrigerator, stove, toaster, and cooking basics like pots, pans, and tableware. There’s also a dining area that comfortably seats six, making it perfect for group meals. GALUNGAN & KUNINGAN SPECIAL DISCOUNT Enjoy a discounted stay from Sept 24-26, 2024 during the Galungan festival, and from Oct 4-5, 2024 for Kuningan. As our team joins the local festivities, no in-house cleaning will be available during both periods, offering you complete privacy to relax and enjoy a tranquil stay. Immerse yourself in Bali’s rich culture while experiencing some of the island’s most beautiful celebrations. NEARBY LOCATIONS Restaurants & Cafe: The Blaze Restaurant: 5 mins ride or 1.1 km Baked Berawa: 7 mins ride or 1.9 km Manggis in Canggu: 8 mins ride or 2.3 km Cantina Classe Italian Restaurant: 12 mins ride or 4 km Ketela Eatery & Lifestyle: 14 mins ride or 4.4 km Milk & Madu: 20 mins ride or 6.4 km Beaches: Berawa Beach: 11 mins ride or 2.9 km Batu Bolong Beach: 19 mins ride or 6.2 km Beach Club: Finns Beach Club: 11 mins ride or 2.9 km Atlas Beach Club: 12 mins ride or 3 km The Lawn Canggu Beach Club: 19 mins ride or 6.2 km Convenience Store: Pepito Market Batu Bolong: 12 mins ride or 3.9 km M Minimart Pantai Berawa: 4 mins ride or 1.2 km Others ATM Mandiri: 3 mins ride or 700 m Maybank ATM: 14 mins ride or 4.7 km Smile Laundry Canggu: 3 mins ride or 700 m Easycoin Laundromat Canggu: 5 mins ride or 1.1 km Clean Station Laundry: 4 mins ride or 1.1 km Apotek Pharmacare Berawa (Pharmacy): 3 mins ride or 650 m Apotek Fit Canggu (Pharmacy): 5 min ride or 1.3 km Guest access Guests will have access to the property unit, including the pool, living area, kitchen, and bedrooms. Enjoy complete privacy during your stay. PARKING AREA Free parking is available on the premises for guests. Other things to note ★ EXCLUSIVE OFFER FROM FUEGO RESTAURANT ★ Enjoy a special 10% discount at Fuego, our partner restaurant in Canggu, exclusively for Bukit Vista guests. Whether you prefer to dine in or order via phone, simply mention that you’re staying with Bukit Vista to claim your discount. You can also check the listing photos for a preview of the menu. Savor delicious meals and make your stay even more memorable with this exclusive offer! ★ Elevate your stay with our exclusive, premium services ★ Spa Services: Indulge in tranquility. Alcohol Drinks: Cheers with premium selections. Private Drive Tour: Book a private drive for a personalized tour around the city’s landmarks. Romantic Room Decoration: Surprise your partner with a romantic room decoration for those special moments. Working Setup: Tailor your productivity space. Reservations for these services can be made directly through chat on Airbnb. Enhance your stay with us! Please note, these premium offerings are not complimentary. SCOOTER RENT Our onsite team can help you with scooter rental. It usually costs around IDR 100K – 200K per day without petrol, including 2 helmets. AIRPORT PICK UP SERVICE We are 35 – 45 minutes from the airport. We can assist you in providing an airport pick-up service at the cost of IDR 325K (around USD 21) per car. POLICY AIRBNB POLICY: Airbnb Policy stated that you can’t contact us directly or do a visit if your booking not confirmed yet. D-14 POLICY: We can only accommodate rescheduling or shorten over your booking D-14 before your check-in dates. NO PARTY: Please refrain from hosting parties to preserve the peaceful environment and respect our neighbors’ tranquility. NO SMOKING: Kindly refrain from smoking to maintain the freshness of the air and ensure a pleasant atmosphere for everyone. NO PET FRIENDLY: We are sorry to inform you that we do not allow pets on this property. ◦ CHECK-IN POLICY Basic Rules Standard Check-in: 14:00 (STRICT) Standard Check-out: 12:00 (STRICT) We do not accept or accommodate any early check-ins. Please plan your arrival accordingly, as we cannot offer early check-in or luggage drop-off services. LATE NIGHT CHECK-IN For a smooth and safe arrival, we recommend that you check in by 5 PM at the latest. Our online hosts are available from 9 AM to 6 PM to assist you. Kindly provide us with your estimated arrival time at least one day in advance (D-1) so we can assist you better. LEAVING LUGGAGE POLICY: Check-in: You cannot leave your luggage before the check-in time. Check-out: After check-out time, if you wish to store luggage only, please inform us. We will then check staff availability and let you know if it’s possible. LATE CHECK OUT Our check-out time is STRICT adhering to our checkout time. We do not accept or accommodate any late check-outs. Please plan your departure accordingly. AIRBNB POLICY Airbnb Policy states that you can’t contact us directly if you haven’t booked yet. PAYMENT METHOD We prefer to take reservations on Airbnb. Airbnb accepts payment methods using Credit Card. If you don’t have a credit card, you can apply for an electronic card issued by banks like: Jenius by BTPN (Indonesia) Digibank by DBS View On Airbnb Villa in Kec. Kuta Utara · ★New · 2 bedrooms · 2 beds · 2 baths Book Now on Airbnb"
