lodging_url,name,author,date_since,airbnb_url,gmap_url,address,city,state,zip,area,country,last_update,property_id,price,bedroom,rooms,bathrooms,garage,property_type,property_status,guest_number,description
https://www.bukitvista.com/property/sunny-tropical-luxe-villa-in-ungasan-with-pool,Sunny Tropical Luxe Villa in Ungasan with Pool,Konang,6 months ago,https://www.airbnb.com/rooms/1148881304405988107?check_in=2024-10-18&check_out=2024-10-19&guests=1&adults=1&s=67&unique_share_id=f2a666a0-9f0b-40f9-b886-990220585d1b,,"Uluwatu st.no.km, Gg. Menesa No.8, Ungasan, Kec. Kuta Sel., Kabupaten Badung, Bali",Bali,Bali,80362,"Badung, Ungasan",Indonesia,"Updated on September 27, 2024 at 11:09 am",PR0864,Starting from USD 172 per night,2,,2,,Villa,"New Listing, Top Trending",4,"About this space Welcome to your private paradise! Nestled in an easily accessible and well-marked location, this stunning 2-bedroom villa combines the tranquility of tropical living with modern comforts to create an unforgettable getaway. Whether you’re here to unwind or explore, everything from pre-arrival to departure is streamlined for your convenience. Features: • Two bedrooms with En-suite bathroom • Fully equipped kitchen • Comfy semi-outdoor living space with a large sofa • Private pool The space Located about 80 meters from the bustling Uluwatu Street, this villa offers easy access to the main road, with some road noise that may be heard as a trade-off for its convenient location. The villa opens into a bright, inviting living room, perfect for relaxation. The bedroom, a tranquil retreat, is tastefully decorated and equipped with everything you need to feel at home. Just steps away, the meticulously maintained private pool with an integrated sunbed invites you to relax and enjoy both sun and stars. While close to main areas, the villa still offers a private environment with many restaurant options nearby. • BEDROOM AREA A spacious and beautifully appointed bedroom awaits, featuring a comfortable King bed, effective air conditioning for a cool retreat, and thoughtful touches like a closet, and decorative pillows. • POOL AREA Your private pool, is meticulously maintained and features a unique sunbed within, ideal for an immersive sunbathing experience. Equipped with bright lights, it offers an enchanting ambiance for nighttime swims. • KITCHEN The kitchen is a delight for any culinary enthusiast, fully stocked with a coffee maker, toaster, and all necessary cooking utensils. Although compact, it offers everything required for preparing delicious meals, from breakfast through dinner. This villa expertly combines functionality with aesthetic appeal. From the inviting bedroom to the cozy communal areas and the well-equipped kitchen, every space is designed to enhance your stay. The outdoor pool area, complete with comfortable seating and ambient lighting, ensures every moment is enjoyable, whether you’re swimming or simply relaxing. • GALUNGAN & KUNINGAN SPECIAL DISCOUNT Enjoy a discounted stay from Sept 24-26, 2024 during the Galungan festival, and from Oct 4-5, 2024 for Kuningan. As our team joins the local festivities, no in-house cleaning will be available during both periods, offering you complete privacy to relax and enjoy a tranquil stay. Immerse yourself in Bali’s rich culture while experiencing some of the island’s most beautiful celebrations. • NEARBY LOCATION & THINGS TO DO: • Lunch and Dinner Experiences: -. El Merkat Bali: Just 100 m away, a quick 2-minute walk for diverse dining. -. Circle K Pecatu Big Swell: Convenient for quick snacks, 100 m or 1 min walk. -. Pepito Express Pecatu: Find groceries and more, only 700 m or a 2-minute drive. • Beach Outings: -. Green Bowl Beach: Secluded and serene, only 5.8 km or 15 mins drive. -. Melasti Beach: Spectacular cliffs and clear waters, 5.7 km or 18 mins drive. -. Karma Kandara Private Beach: Exclusive beach access, 4.5 km or 12 mins drive. -. Pandawa Beach: Known for its dramatic coastal cliffs, 7.6 km or 20 mins drive. • Hangouts: -. Tarrabelle: Cozy and inviting, just 550 m or a 2-minute drive. -. Mïnoo Beach Club: Stylish beachfront spot, 6 km or 17 mins drive. -. Sundays Beach Club: Offers a luxurious beach experience, 5.3 km or 13 mins drive. -. Savaya: Famous for its vibrant day parties, 4 km or 13 mins drive. • Tourist Attractions: -. Garuda Wisnu Kencana Cultural Park: Explore local culture and art, 3.4 km or 11 mins drive. -. Uluwatu Temple: Iconic cliffside temple with sunset views, 7.8 km or 19 mins drive. • Convenience Services: -. BCA ATM and Cahaya 2 Cell: Essential services just 100 m away, a 1-minute walk. -. DFC GYM: Stay fit on vacation, only 500 m or a 2-minute drive. Guest access Guests have full access to the villa, including the private pool, kitchen, and dedicated parking area suitable for cars and motorcycles. A key box ensures a smooth self-check-in process. Other things to note • SCOOTER RENT Take the scenic route around Uluwatu’s rolling hills and pristine beaches with our convenient scooter rental service, priced between IDR 100K – 150K per day, excluding petrol, but inclusive of 2 helmets for your safety adventures. • AIRPORT PICK UP SERVICE Begin your tranquil getaway with ease by opting for our airport pick-up service. We can arrange your transportation from the airport to the villa for IDR 325K (approximately USD 21) per car, providing a hassle-free start to your stay. • ONLINE TRANSPORTATION Convenient and reliable transportation options are available with Gojek and Grab apps. Easily book rides, order food, or send parcels right from your smartphone. • CHECK-IN POLICY Basic Rules Standard Check-in: 3:00 PM (STRICT) Standard Check-out: 11:00 AM (STRICT) • EARLY CHECK-IN We do not accept or accommodate any early check-ins. Please plan your arrival accordingly, as we cannot offer early check-in or luggage drop-off services. • LATE NIGHT CHECK-IN For a smooth and safe arrival, we recommend checking in by 5 PM at the latest, especially considering the dark areas after sunset which might pose challenges. Our online hosts are available from 9 AM to 6 PM to assist you. Kindly provide us with your estimated arrival time at least one day in advance (D-1) so we can assist you better. • LATE CHECK-OUT Our check-out time is STRICTLY 11 AM. We do not accept or accommodate any late check-outs. Please plan your departure accordingly. • AIRBNB POLICY Airbnb Policy states that you can’t contact us directly if you haven’t booked yet. For safety reasons, we are unable to do a site visit before the booking is confirmed. The exact address, directions, and details of the property will be given after you book the property. • PAYMENT METHOD We prefer to take reservations on Airbnb. Airbnb accepts payment method using Credit Card – If you don’t have a credit card, you can apply for an electronic card issued by banks like: – Jenius by BTPN (Indonesia) – Digibank by DBS • Additional information ◦ No pets are allowed In maintaining the serene ambiance of the villa and ensuring the comfort of all our guests, pets are not permitted on the property. ◦ No breakfast No breakfast service is provided, allowing you to explore the local cuisine. View On Airbnb Villa in Kecamatan Kuta Selatan · ★4.94 · 2 bedrooms · 2 beds · 2 baths Book Now on Airbnb"
https://www.bukitvista.com/property/dreamy-haven-w-pool-300m-from-bingin-beach,Dreamy Haven w/ Pool | 300m from Bingin Beach,Konang,6 months ago,https://www.airbnb.com/rooms/1151074800709335738?guests=1&adults=1&s=67&unique_share_id=f45b1963-f2f1-4043-b820-f9771eb57f57,http://maps.google.com/?q=Villa%20Kaba%20by%20Bukit%20Vista,"54V8+52M, Jl. Pantai Bingin, Pecatu, Kec. Kuta Sel., Kabupaten Badung, Bali",Bali,Bali,80361,Badung,Indonesia,"Updated on September 26, 2024 at 3:50 pm",PR0858,Starting from USD 430 per 2 nights,2,,2,,Villa,Top Trending,4,"About this space Escape to the serenity of Bingin Beach with this elegantly appointed 2-bedroom villa, designed for those who appreciate the blend of modern comfort and tropical luxury. Nestled just a short walk from the renowned surf breaks of Bingin Beach, It’s a haven for families with kids, surfers, and sun lovers. Key Features – 2 King-sized bed w/AC – Fully Equipped Kitchen – Private Pool – Dedicated Working Space – 300 meters from Bingin Beach (4 minutes walk) – Walk distance to nearby Cafe & Restaurant The space This modern luxury villa retreat has two bedrooms, each with cozy bedding, air-conditioning, mosquito net and plenty of storage. Each room has access to its en-suite bathroom, offering amazing accommodation options for every guest. The heart of the home is the fully equipped modern kitchen, whether you’re preparing a quick breakfast before a day at the beach or a leisurely dinner. You’ll have everything you need to create magic in a variety of cooking styles. OUTDOOR LIVING – Garden and Pool: Step outside to your private outdoor oasis where a refreshing swimming pool awaits. Lounge on the sunbeds with your favorite book, or enjoy a dip in the pool under the open sky. The pool area is surrounded by lush tropical plants that provide privacy and a feeling of being in your secluded paradise. LOCATION – Everything Within Walking Distance: Located just 300m from Bingin Beach, you are never far from the surf and sand. Known for its impressive waves and vibrant local scene, Bingin Beach offers both excitement and relaxation. Dine at nearby beachfront cafes, explore local shops, and enjoy the laid-back atmosphere of one of Bali’s most beloved surf spots. ATMOSPHERE – Peaceful and Quiet for Recharging Day & Nights Embrace the serenity of night at our secluded villa, where peace and quiet envelop you under the starlit sky. The villa offers an idyllic retreat from the hustle and bustle of daily life, positioned far from the main road to ensure a restful night without the disturbance of traffic noise. As evening falls, the soft symphony of crickets and local wildlife provides a soothing natural backdrop, perfect for relaxation and a night of deep sleep. While the villa is nestled in a tranquil setting, the occasional gentle barks from neighborhood dogs, or faint music adds a touch of liveliness to the peaceful nights without disrupting your rest. This is the ideal spot for those seeking a calm sanctuary where nature’s own lullabies enhance your holiday experience, ensuring each night is as restorative as it is enchanting. KITCHEN – Meals at Home: Experience the joy of cooking in the fully equipped kitchen, designed with the culinary enthusiast in mind. This modern kitchen features state-of-the-art appliances, including a full-sized refrigerator, stove, and microwave, complemented by sleek countertops and high-quality cookware. Whether you’re whipping up a quick breakfast or hosting a delightful dinner, this kitchen makes every meal an easy and enjoyable affair. • GALUNGAN & KUNINGAN SPECIAL DISCOUNT Enjoy a discounted stay from Sept 24-26, 2024 during the Galungan festival, and from Oct 4-5, 2024 for Kuningan. As our team joins the local festivities, no in-house cleaning will be available during both periods, offering you complete privacy to relax and enjoy a tranquil stay. Immerse yourself in Bali’s rich culture while experiencing some of the island’s most beautiful celebrations. NEARBY LOCATION – Everything You Need Nearby Beaches: – Bingin Beach – 4 Min walk (300 m) – Dreamland Beach – 7 Min drive (2.1 km) – Padang Padang Beach – 7 Min drive (2.4 km) – Uluwatu Beach – 13 Min drive (4.1 km) Daily Needs: – BTC / Bali Training Center – 2 Min walk (220m) – Alchemy Yoga – 2 Min drive (900m) – Bambu Fitness Bali – 3 Min drive (800 m) – Made Printing – 5 Min drive (1.4 km) – SIM Card Telkomsel Bingin – 1 Min drive (270 m) – Jet Black Ginger (Hair Salon) – 2 Min drive (600 m) – Winda Laundry – 8 Min drive (2.8 km) Eatery & Hangout Places *Walking distance: – Kelly’s Warung – 1 min walk (110m) – The Cashew Tree – 2 Min walk (220 m) – Seed Bingin – 3 Min walk (200m) – Fren’cha Bakery Bingin – 4 Min walk (290 m) – Abracadabra by Mu Bunglaow – 4 Min walk (350m) *Short drive: – Lucky Fish Lounge – 4 min drive (650m) – DiVino by Casa Asia – 3 Min drive (850m) – Banana Lounge – 4 Min drive (850 m) – Alchemy Uluwatu – 4 Min drive (1.2km) – Drifter Surf Shop, Cafe & Gallery – 4 Min drive (1.4km) – Ours Uluwatu – 5 min drive (1.5km) – Gooseberry Restaurant – 5 Min drive (1.5 km) – El Kabron – 5 Min drive (1.5 km) – Warung Local – 5 min drive (1.6km) – Oyà Bali – 5 Min drive (1.7 km) – Sugar Rock – 6 Min drive (1.8 km) – Botol Biru Bar and Grill – 8 Min drive (2.2 km) – Single Fin – 12 Min drive (4.5km) Guest access The villa is exclusively yours during your stay, from the inviting private pool in the serene outdoor space, where you can relax and unwind, to the fully equipped modern kitchen for your culinary explorations. Enjoy the privacy of your bedrooms, the comfort of the spacious living areas, and the lush surroundings that make this place a peaceful retreat. PARKING AREA Our private parking area accommodates up to 2 cars or 8 motorcycles. Kindly plan accordingly to ensure a comfortable and organized parking experience during your stay Other things to note DARK & BUMPY ROAD NOTICE Please be advised that the road to the property is unpaved and may be bumpy. We recommend driving slowly and with caution. As night falls, the road to our villa remains quiet, with minimal street lighting. However, the parking area at the villa is well-lit, ensuring your safety and comfort upon arrival. This secluded approach enhances the feeling of a private escape into nature, making your arrival at the villa even more serene and exclusive. • EARLY CHECK-IN Basic Rules Standard Check-in: 14:00 (STRICT) Standard Check-out: 12:00 (STRICT) • EARLY CHECK-IN We do not accept or accommodate any early check-ins. Please plan your arrival accordingly, as we cannot offer early check-in or luggage drop-off services. • LATE NIGHT CHECK-IN For a smooth and safe arrival, we recommend checking in by 5 PM at the latest, especially considering the dark areas after sunset which might pose challenges. Our online hosts are available from 9 AM to 6 PM to assist you. Kindly provide us with your estimated arrival time at least one day in advance (D-1) so we can assist you better. • LATE CHECK-OUT Our check-out time is STRICTLY 12PM. We do not accept or accommodate any late check-outs. Please plan your departure accordingly. • LEAVING LUGGAGE POLICY: – Check-in: You can’t leave your luggage before the check-in tim. – Check-out: After check-out time, if you wish to store luggage only, please inform us. We will then check staff availability and let you know if it’s possible. • AIRBNB POLICY Airbnb Policy states that you can’t contact us directly if you haven’t booked yet. ◦ NO PETS ARE ALLOWED We are sorry to inform you that we do not allow pets on this property. ◦ NO SMOKING POLICY For the comfort and health of all our guests, smoking is strictly prohibited in all rooms. If you wish to smoke, please do so in designated smoking areas outside. We appreciate your cooperation in keeping our rooms smoke-free. • PAYMENT METHOD We prefer to take reservations on Airbnb. Airbnb accept payment method using Credit Card – If you don’t have a credit card, you can apply for an electronic card issued by banks like: – Jenius by BTPN (Indonesia) – Digibank by DBS View On Airbnb Villa in Bingin Beach · ★4.81 · 2 bedrooms · 2 beds · 2 baths Book Now on Airbnb"
https://www.bukitvista.com/property/ungasan-haven-3br-villa-w-private-pool-retreat,Ungasan Haven: 3BR Villa w/ Private Pool Retreat,Konang,9 months ago,https://www.airbnb.com/rooms/1156105563763952738?guests=1&adults=1&s=67&unique_share_id=c5a6ba39-d0f8-4e47-8fed-06adcf60a181,http://maps.google.com/?q=Amerta%20Puratangi%20Villa%20by%20Bukit%20Vista,"Jl. Pura Tangi, Ungasan, Kec. Kuta Sel., Kabupaten Badung, Bali 80361",Bali,Bali,80361,Ungasan,Indonesia,"Updated on January 9, 2025 at 11:51 am",PR0767,"Starting from USD 2,400 per month",3,,3.5,,Villa,"Bali Vacation Rental, Long Stay Trend Property",6,"Embrace the harmonious blend of modern architecture and traditional charm at our exquisite Uluwatu retreat. Ideal for digital nomads and remote workers seeking inspiration, or couples looking for a romantic getaway, this haven offers a serene environment, fast Wi-Fi, and close proximity to cultural sites and vibrant beach clubs. Features: • Spacious, air-conditioned rooms • Serene outdoor pool • Fully equipped kitchen • Wi-Fi with speeds up to 38 Mbps • Proximity to Uluwatu’s attractions The space • ROOM ARRANGEMENT Each room, adorned with refined Balinese art, features comfortable bedding, large windows, and a dedicated workspace with a scenic view. • POOL A private, tranquil pool flanked by tropical flora and comfortable sun loungers, offers a refreshing escape. • KITCHEN A modern kitchen with sleek countertops, including a refrigerator, stove, and microwave, catering to all your culinary needs. • LIVING ROOM Our spacious living room is a breezy haven, where ceiling fans circulate the island’s natural air to ensure your leisure moments are bathed in comfort. Embrace the gentle rhythms of Bali’s climate in this thoughtfully designed area, promising a refreshingly cool ambiance for your enjoyment and relaxation. • WIFI The Wi-Fi speed in our villa is approximately 38 Mbps, which you can use for work. But please keep in mind that wifi speed depends on the number of users. Just a heads up: during the rainy season, there might be some occasional hiccups in the WiFi, even though we’ve partnered with a great company. • NO EXTRA BED To maintain the design integrity and guest experience, extra beds are not available. • STAY FIT IN BALI WITH DFC GYM Located 2,6km or 8 minutes drive from our property, DFC Gym features modern equipment, showers, lockers, and welcoming staff. Enjoy a boost from local Bali coffee and healthy snacks while maintaining your fitness routine. Choose from affordable daily to monthly rates. Energize your stay with a great workout at DFC Gym! • NEARBY LOCATIONS ◦ Nearby Beaches: – Padang Padang Beach – 6.1 km or 13 mins drive – Bingin Beach – 6.2 km or 14 mins drive – Dreamland Beach – 6.7 km or 16 mins drive – Balangan Beach -7.4 km or 17 mins drive – Suluban Beach – 8.3 km or 17 mins drive ◦ Cultural Sites: – Uluwatu Temple – 7.3 km or 13 mins drive – GWK Cultural Park – 5.6 km or 12 mins drive ◦ Eatery: – Suka Espresso – 7.4 km or 15 mins drive – The Cashew Tree – 6 km or 13 mins drive – Warung Bejana – 7.3 km or 13 mins drive – El Kabron – 6.5 km or 15 mins drive ◦ Hangout Places: – Single Fin – 8.3 km or 18 mins drive – Omnia Dayclub – 3.5 km or 10 mins drive – The Edge – 84.1 km or 11 mins drive – Drifter Surf Shop & Cafe – 5 km or 11 mins drive Guest access Enjoy full access to the entire property, ensuring a private and exclusive stay. • PARKING AREA Secure on-site parking is available for your convenience. Other things to note • FOOSBALL TABLE Feel free to enjoy our foosball table at your convenience during your stay on our property. • BREAKFAST We want to inform you that we do not provide breakfast, However, feel free to use the provided shared kitchen area to cook any meal you desire. • CONSTRUCTION Please note that ongoing construction next to the property will bring some noise during your stay. The construction usually starts at 8 AM – 5 PM. The construction is estimated to be done by June 2024. While we aim to ensure your comfort, noise may be noticeable. Consider using earplugs for a better stay. Your comfort is vital, and we appreciate your understanding! • POLICY ◦ AIRBNB POLICY: Airbnb Policy states that you can’t contact us directly or make a visit if your booking not been confirmed yet. ◦ D-14 POLICY: We can only accommodate rescheduling or shortening your booking D-14 before your check-in dates. ◦ NO PARTY: Please refrain from hosting parties to preserve the peaceful environment and respect our neighbors’ tranquility. ◦ NO SMOKING: Kindly refrain from smoking to maintain the freshness of the air and ensure a pleasant atmosphere for everyone. ◦ NO PET FRIENDLY: We are sorry to inform you that we do not allow pets on this property. ◦ CHECK-IN POLICY ■ Basic Rules – Standard Check-in: 14:00 (STRICT) – Standard Check-out: 11:00 (STRICT) ■ Early Check-In Time Please do note that you can’t arrive early from the basic rules. Any early check-in before 9 AM will be considered as a D-1 Extension, so please kindly extend your booking 1 day early to accommodate your request. ■ Late Check In Time For a smooth and safe arrival, we recommend checking in by 5 PM at the latest, especially considering the dark areas after sunset which might pose challenges. Our online hosts are available from 9 AM to 6 PM to assist you. Kindly provide us with your estimated arrival time at least one day in advance (D-1) so we can assist you better! ◦ LEAVING LUGGAGE POLICY ■ Check-in: Unfortunately, storing luggage prior to the standard check-in time is not permitted. ■ Check-out: To hold luggage after check-out, please notify us in advance so our staff can verify the availability. ◦ CHECK-OUT POLICY It is possible to have a late check-out as per room availability. Please note that for late check-outs between 2 – 6 pm, an additional half-day charge will apply at the nightly room rate. Any check-outs after 6 pm will be charged at a full day’s nightly room rate. But if you’d like to leave luggage only, please kindly tell us and we’ll inform you whether it’s possible or not, following staff availability. Thanks so much for your understanding! • ADDITIONAL SERVICE ◦ Airport Pick Up Service We are 50 – 60 minutes from the airport. We can assist you in providing an airport pick-up service at the cost of IDR 325K (around USD 21) per car ◦ Scooter Rent We can help you with scooter rental which usually costs around IDR 100K – 150K per day without petrol, including 2 helmets. Do let us know in advance if you need it to help arrange it better. ◦ Car Rent Full-day car rental is also available at the cost of IDR 800K (around USD 57) for up to 8 hours, including driver & gasoline. Parking fees, highway fees, and entrance fees (if any) are not included. Additional hours are chargeable at IDR 100K (around USD 8) per hour. Car capacity up to 5 guests without luggage. • NATURE’S SYMPHONY WITH GECKOS While our villa is surrounded by the beauty of nature, being close to the great outdoors means you might not only hear the occasional gecko calling out but also witness their appearance, adding to the natural ambiance of this serene environment. • PAYMENT METHOD We prefer to make a reservation on Airbnb. Airbnb accepts the following payment method: Credit Card. If you don’t have a credit card, you can apply for an electronic card issued by banks like: – Jenius by BTPN (Indonesia) – Digibank by DBS Book Now on Airbnb"
