lodging_url,name,author,date_since,airbnb_url,gmap_url,address,city,state,zip,area,country,last_update,property_id,price,bedroom,rooms,bathrooms,garage,property_type,property_status,guest_number,description
https://www.bukitvista.com/property/bukit-vista-heritage-joglo-villa-w-private-pool-2,Bukit Vista | Heritage Joglo Villa w/ Private Pool,,2 years ago,https://www.airbnb.com/rooms/54061345,"http://maps.google.com/?q=gupasan,%20Kec.%20Gondomanan,%20Kota%20Yogyakarta,%20Daerah%20Istimewa%20Yogyakarta%2055122","gupasan, Kec. Gondomanan, Kota Yogyakarta, Daerah Istimewa Yogyakarta",Yogyakarta,Yogyakarta,55122,,,"Updated on March 27, 2023 at 10:58 am",PR0697,Mulai dari Rp1.750.000 Rupiah per Malam,4,,3,,Villa,"Private Pool, Yogyakarta Vacation Rental",8,"Enter the vast culture of Yogyakarta and be welcomed by warm smiles in this heritage Joglo villa in Kauman. Equipped with Wifi, a private pool, kitchen, living room; which can accommodate up to 8 people. Only a walking distance to the Yogyakarta Palace, it’s no doubt that you will have an immersive experience, with Bukit Vista. We will be waiting to warmly welcome you with open hands! ☑ FAST WIFI ☑ PRIV. POOL ☑ 4BR (2 w/ AC & 2 w/ fan) ☑ PRIV. KITCHEN ☑ BIG LIVING ROOM ☑ 3 BATHROOMS The space Immerse yourself in the rich Javanese heritage in this traditional Joglo family villa, one of the few spacious houses that can accommodate up to 8 people and fully equipped with a family sized private pool, private kitchen, living room, 4 bedrooms, 3 bathrooms, and even a fast wifi. A multi-generational historical gem with a semi-outdoor style, you can experience the richness of traditional Indonesian living. Feel the gentle breeze and warm sunshine and start a beautiful morning in Yogyakarta. ★ PROPERTY FEATURES ☑ KITCHEN The kitchen is fully equipped and there is also a rice cooker provided. ☑ WIFI Fully equipped with fast Wifi. ☑ LIVING ROOM Spacious living room comfortable for gatherings. ☑ PRIVATE POOL Family sized private pool all for you. ☑ 4 BEDROOMS This villa has 4 bedrooms that can be used for 2 people in each room (2 bedrooms with AC & 2 with fans only). Don’t worry because it won’t be too hot without AC. ☑ BATHROOMS 2 en suite bathrooms in the bedroom with air conditioning, 1 bathroom outside. ★ NEARBY ATTRACTIONS ☑ 12 minutes drive to Jalan Malioboro ☑ 5 minutes walk to Yogyakarta Palace ☑ 8 minutes drive to the legendary Gudeg Yu Djum Wijilan ☑ 11 minutes drive to Taman Sari Guest access The villa is all yours during your stay, meanwhile the parking area public space belongs to Masjid Gede Kauman. Our villa is located in the village of Kauman, where there’s a lot of small street, which makes it quite possible to ride a bike into it. You can request for assistance in parking. ★ SPECIAL REQUESTS ☑ PARKING SPACE Motorcycle parking can be done in front of the villa, but must be guided and the engine is off. Car park is in the parking lot of Masjid Gede Kauman (3 minutes walking/200m from the villa). IT IS A 24-hour PUBLIC PARKING AREA that can accommodate dozens of cars, NOT PRIVATE PARKING. Please do not leave your valuables in the car. We will free the parking fee for one car (except minibus like HIACE, it will be charged 50K/24hr/minibus). If you bring more, you will have to pay the other cars. Car parking fee is around Rp 10.000/car (per in and out). Car parking fee is around Rp 50.000/car (per 24 hours) One of OUR TEAM will be waiting for you in the parking lot of Masjid Gede Kauman to help park the car, carry your luggage, and take you to the villa. The trip from the parking lot to the villa is approximately 3 MINUTES on foot. Other details to note IS BREAKFAST INCLUDED? We would like to inform you that we do not provide breakfast. CAN WE GET EXTRA BEDS? We are sorry to inform you that we do not provide extra beds at this property. IS IT PET FRIENDLY? Unfortunately, you cannot bring pets to this property. IS THERE PARKING AREA? As it is located in a friendly little alley, cars will not fit on the road so there is no parking space on the property. But you can park your car on the street around outside the alley or in the parking lot of Masjid Gede Kauman. CAN I RENT A SCOOTER? Yes, of course! Our on-site team can assist you with scooter rental. Usually it costs around IDR 80K – 100K per day without petrol, including 2 helmets. CAN I RENT A CAR? Full day car rental is also available at a cost of IDR 600K (approximately USD 47) for up to 8 hours, including driver & petrol. Parking fees, highway fees and entry fees (if any) are not included. Additional hours are charged IDR 50K (approximately USD 4) per hour. Car capacity up to 6 guests without luggage. HOW TO CHECK-IN? Please note that our check-in time is 14:00 (STRICT) onwards, Early check-in is subject to availability and may incur additional charges HOW TO CHECK-OUT? Please note that our check-out time is 12 noon. Late check-out is subject to availability and may incur additional charges. We may not be able to promise a slower check-out service at this time, but you can leave your room and pack your luggage during the day while our on-site team starts cleaning the room. WHAT ARE THE POLICIES/RULES ON THIS VILLA? ☑ No smoking in bedrooms and bathrooms (only allowed in communal public spaces or living rooms) ☑ No eating and drinking around and inside the swimming pool ☑ Check-in 14; see 12 ☑ Free of charge for children under 12 years old ☑ Extra bed is NOT AVAILABLE. ☑ If guests want BBQ, please use a picnic blanket outside the Joglo (provided in the private kitchen) ☑ There will be an additional fee in case of damage and loss of goods at the property ☑ Please wear appropriate clothes outside the villa due to the local culture prevailing in the area ☑ Keep noise at low level after 8pm ☑ Rinse before swimming, wear proper swimwear HOW DO WE PAY? We prefer to make reservations on Airbnb. Airbnb accepts the following payment methods: Credit Card & Pay Pal If you do not have a credit card, you can use an electronic card issued by a bank such as: ☑ Jenius by BTPN (Indonesia) ☑ Digibank by DBS Book Now on Airbnb"
https://www.bukitvista.com/property/prestigious-apartment-w-mt-merapi-view,Prestigious Apartment w/ Mt. Merapi View,,2 years ago,https://www.airbnb.com/rooms/638686098836773495,"http://maps.google.com/?q=Caturtunggal,%20Kec.%20Depok,%20Kabupaten%20Sleman,%20Daerah%20Istimewa%20Yogyakarta%2055281","Caturtunggal, Kec. Depok, Kabupaten Sleman, Daerah Istimewa Yogyakarta",Yogyakarta,Yogyakarta,55281,Yogyakarta,,"Updated on October 9, 2023 at 10:46 am",PR0731,Mulai dari Rp810.000 Rupiah per Malam,,,,,Guest House,Yogyakarta Vacation Rental,2,"Exclusively managed by BUKIT VISTA. Located in Uttara, one of the most prestigious apartment building in Jogja. This room is owned & designed by Dubai-based Indonesian artist: Ayang Cempaka. Well known for colourful and whimsical illustrations, her approach to interior design takes on a minimalistic ‘japandi’ style. Natural materials and colours will give you a calm and comforting feeling during your stay. ☑ QUEEN SIZED BED ☑ SMART TV ☑ WFH FRIENDLY ☑ CITY SKYLINE VIEW ☑ SHARED POOL & GYM The space This private apartment room is owned and designed by Indonesian artist Ayang Cempaka. The interior of the room is designed with inspiration from Japanese and Scandinavian design elements. It is perfect for a couple’s staycation time or maybe with a friend. The room has an amazing view of Jogja city. It is WFH friendly with fast wifi and ergonomic desk & chairs. ★ PROPERTY FEATURES ☑ WIFI Fast wifi that will help you comfortably WFH. ☑ BEDROOMS Includes a queen size bed (160 x 200cm) ☑ SHARED POOL ★ LOCATION: This property is located in the prime central area of Jalan Kaliurang neighborhood. Multiple Restaurants and Street Food within 5 min walking distance:, Gudeg and Bakpia (Jogja Traditional Food), Hayam Wuruk Chicken, Hoka-Hoka Bento, Yoshinoya, Padang Sederhana, Dunkin Donuts, Pizza Hut, Bungong Jeumpa, and many others! Starbucks is just downstairs and the minimarket is directly across the street. This apartment is located in the heart of Yogyakarta, which is dominated by the Muslim community. There are many mosques scattered in every village around this apartment. You will quickly feel the Islamic culture when you stay here because the call to prayer & muezzin sounds a bit loud. If you find it bothersome, we suggest you to use earplugs. ★ NEARBY ATTRACTIONS: ☑ 500 m or 6 mins walk to Tempo Gelato ☑ 800 m or 11 mins walk to Gadjah Mada University ☑ 2.5 km or 7 mins drive to Panti Rapih Hospital ☑ 3.7 km or 14 mins drive to The House of Raminten ☑ 4.5 km or 12 mins drive to Lempuyangan and Tugu Train Stations ☑ 5.1 km or 13 mins drive to Malioboro Street Guest access The room is all yours. The shared facilities like swimming pool and gym will be free for the guests. ★ SPECIAL REQUESTS ☑ PARKING SPACE Please note that there is an extra charge for parking if you bring your own transportation: Car: We recommend you to use the valet parking service (IDR 75k per 24 hours with subvention IDR 25k per 24 hours from the management). You have free access for in and out for 24 hours if use the valet. But if you want to use the regular parking instead it will cost you IDR 100k if the vehicle will stay for the entire night. Motorcycle: IDR 2.000 / First Hour IDR 1.000 / Next hour Other details to note BREAKFAST We want to inform you that we don’t provide breakfast, but there’s a lot of options for food. This property is located in a central area of Jalan Kaliurang neighborhood. Also a lot of restaurants near apartment will delighted you with special cuisine! Gudeg and Bakpia (typical food of Jogjakarta), Hayam Wuruk Fried Chicken, Tempo Gelato Ice Cream, Dunkin Donuts, Pizza Hut, Bungong Jeumpa, Padang Sederhana, and many more. Starbucks in on the GF of the building, multiple other unique coffee shops are around. SHARED POOL You will have free access to the shared pool. LONG STAY Long stay is available. Please message us for more details. EXTRA BED Unfortunately WE DON’T PROVIDE EXTRA BED. CHECK-IN POLICY Early check-in is subject to availability of the room, but normally you can arrive early and drop your luggage there. You can use common facilities or go out first while waiting for your room to be ready (usually around 2 pm). Basic Rules Standard Check-in : 14:00 Standard Check-out : 12:00 Early Check In If there’s no other guest in the morning of your check-in day, we may be able to speed up your check-in time with extra charge with the details below: Early check – in before 13:00 = 25% of the nightly rates Early check – in before 10:00 = 50% of the nightly rates Early check – in before 8:00 = 100% of the nightly rates Please be informed that our check-in time is at 14:00 by default. However, you are most welcome to arrive at an earlier time, drop your luggage first and start enjoying your day at the pool or exploring the area while waiting for your apartment to be ready. CHECKOUT POLICY Our check-out time is at 12:00 noon. Late check-out is subject to availability and might involve extra charge as well. We might not be able to promise any late check-out service at this point. However, you may leave the room and pack your luggage by noon time while our onsite team starts cleaning the apartment. PAYMENT METHOD We prefer to take reservation on Airbnb. Airbnb accepts the following payment method: Credit Card & Pay Pal If you don’t have a credit card, you can apply for an electronic card issued by banks like: Jenius by BTPN (Indonesia) Digibank by DBS Googl Pay (use debit card) Book Now on Airbnb"
https://www.bukitvista.com/property/stylish-rustic-cabin-in-penida-near-seaside-cafe,Stylish Rustic Cabin in Penida near Seaside Cafe,Bukit Vista,2 years ago,,"http://maps.google.com/?q=Jl.%20Ped%20-%20Buyuk,%20Ped,%20Nusapenida,%20Kabupaten%20Klungkung,%20Bali%2080771","Jl. Ped - Buyuk, Ped, Nusapenida, Kabupaten Klungkung, Bali",Nusa Penida,Nusa Penida,80771,Nusa Penida,Indonesia,"Updated on March 22, 2023 at 10:44 am",PR0603,Start from $24 per night,,2,,,"Guest House, Residential","Nusa Penida Vacation Rental, Private Pool",,"Welcome to our minimalist design cabin with a pool view with lots of birds chirping in the backyard. It’s ideal for those who want to experience Penida festivity. Make this shady cabin your escape to enjoy the beautiful nature. Our room is equipped by: ✔ Super clean room with a queen bed size ✔ Private Bathroom ✔ Air Conditioner ✔ Free wifi ✔ Hot Water ✔ Private Patio with Jungle View ✔ A shared fresh pool ✔ Walking distance to a few restaurants down to the main road. The space Feel the refreshing scent of the morning ray from the sunrise, and makes ready to begin your adventure in Nusa Penida. Indulge all of your senses with the peaceful ambiance and feel at home! BEDROOM & BATHROOM You’ll have your own bedroom and ensuite bathroom. PATIO Your patio is attached to your room, you can have a nice talk with your roommate or other guests as you like. The water heater is also provided if you want to make your own tea/coffee. RECOMMENDED LOCATIONS Attractions: – Toya Pakeh harbour – 10 mins drive – Sampalan harbour – 12 mins drive – Crystal Bay (one of the most popular snorkeling and diving spot in Nusa Penida) – 25 mins drive – Kelingking Beach (one of the most famous spots of Nusa Penida) – 40 mins drive – Broken Beach & Angel Billabong (The naturally formed rock lagoon offers a scenic seascape) – 46 mins drive Eats and Shop: – Penida Colada Beach Bar (beachfront restaurant & bar chill island vibes) – 2 mins drive – Sunny Cafe Penida (Mexican American Mediterranean Asian Thai Indonesian food) – 8 mins drive – Greenkubu Penida (Restaurant – Clifftop Bar – Pool) – 18 mins drive Guest access SHARED POOL Enjoy our shared pool that is surrounded by the forest. You can also use the sunbeds to have a relaxing time in the morning while admiring nature’s finest beauty. ACCESS TO OUR VILLA We suggest you dock in Banjar Nyuh/Toya Pakeh port and we will help you to organize pick up. It took only about 10 mins drive distance. Other things to note BREAKFAST Unfortunately we do not provide breakfast. But you can walk 5 minutes to Penida Colada Beach Bar or Coco Penida Restaurant & Bar. SCOOTER RENT Yes, sure! Our onsite team can help you with scooter rental. It usually costs around IDR 80K – 100K per day without petrol, including 2 helmets. CAR RENTAL Full day car rental is also available with the cost at IDR 600K (around USD 47) for up to 8 hours, including driver & gasoline. Parking fees, highway fees and entrance fees (if any) are not included. Additional hours is chargeable at IDR 50K (around USD 4) per hour. Car capacity up to 6 guests without luggage. PICK UP SERVICE We are 50 – 60 minutes from the airport. We can assist you to provide an airport pick up service with the cost at IDR 450K (around USD 31) per car with driver including gasoline, with a maximum capacity of 5 people + luggage. The driver will be waiting for you at the arrival hall by holding signage of your name. Book now on Airbnb"
https://www.bukitvista.com/property/beachfront-bungalow-w-sunset-view,Beachfront Bungalow w/ Sunset View,Bukit Vista,2 years ago,https://www.airbnb.com/rooms/35138761?guests=1&adults=1&s=67&unique_share_id=6c258325-87b4-4f26-8d94-f5ff6c64ce10,"http://maps.google.com/?q=Jl.%20Ped%20-%20Buyuk,%20Banjar%20Bodong,%20Desa%20Ped,%20Kec%20Nusa%20Penida,%20Kabupaten%20Klungkung","Jl. Ped - Buyuk, Banjar Bodong, Desa Ped, Kec Nusa Penida, Kabupaten Klungkung",Nusa Penida,Nusa Penida,,Nusa Penida,Indonesia,"Updated on March 20, 2023 at 5:51 pm",PR0427,Start from USD $41 per night,,2,,,"Beachfront, Guest House, Residential",,,"✦ Managed by BUKIT VISTA ✦ No adventure is complete with a peaceful stay in this adorable beachfront bungalow with stunning ocean view. The sky takes on shades of orange during sunset and the soft sounds of waves will accompany you throughout your stay. Our facilities ☑ Bedroom w/ Queen size bed and AC ☑ up to 15 Mbps Wifi ☑ TV cable ☑ Private bathroom ☑ Private terrace ☑ Breakfast The space ABOUT THE PROPERTY You will be staying in a Balinese-style bungalow that has direct access to the beach. Feel free to relax around the property area or head straight to the beach. You can also enjoy a private patio at this property. BEDROOM Your bedroom comes with a queen-size bed and air-conditioned space to keep you cool. BATHROOM This property has a clean private bathroom NEARBY LOCATIONS – Penida Colada Beach bar: 5-minute walk – 300m – Toyapakeh Harbor: 4 Km – Sampalan Harbor: 15 min – 5.5 km. – Crystal Bay: 30 min – 12 km – Kelingking Beach: 1 hour – 20 km – Broken Beach & Angel Billabong: 1 hour – 20 km. – Atuh Beach: 1 hour – 25 km. Guest access The entire room is yours, private bedroom and the private bathroom. Also, you are most welcome to enjoy our beachfront view while have a relaxing lay back on our chaise longue. You will have direct access to the beach. BREAKFAST Breakfast for 2 people is included in the price. Other things to note Book now on Airbnb"
https://www.bukitvista.com/property/once-in-a-lifetime-hilltop-bungalow-experience,Once in a Lifetime Hilltop Bungalow Experience,Bukit Vista,2 years ago,https://www.airbnb.com/rooms/32054722?guests=1&adults=1&s=67&unique_share_id=fb974180-3bc6-4e29-b2a1-f6a3be483f81,"http://maps.google.com/?q=Suana,%20Nusapenida,%20Kabupaten%20Klungkung,%20Bali%2080771","Suana, Nusapenida, Kabupaten Klungkung, Bali 80771",Nusa Penida,Nusa Penida,,Nusa Penida,Indonesia,"Updated on March 21, 2023 at 4:11 pm",PR0371,Start from $19 USD per night,,2,,,"Guest House, Residential","Good Deal, Nusa Penida Vacation Rental",,"This gem accommodation is curated by BUKIT VISTA Feel the tremendous experience with stay on a cliff-top bungalow & waking up to the breathtaking sunrise view. You’ll have a standard room type facing the ocean & we’re happy to help your tropical Penida journey memorable. It takes 5 minutes to walk to get to Giri Temple, a must-visit place in Nusa Penida. ☑ Bedroom with a double-bed ☑ Private bathroom with no hot water ☑ AC ☑ Dedicated workspace ☑ Patio ☑ Free wifi The space BEDROOM This property has 4 rooms and you’ll have one standard room. This room has a very comfortable bed, a sparkling clean bathroom, an air conditioner, and a terrace to enjoy your morning. BREAKFAST IS NOT INCLUDED Breakfast is available with additional charge. NOT PET-FRIENDLY Please note that our property is not pet-friendly. But you can confirm with our team about the type of pet you will bring. ★ PLEASE NOTE ⚠ Saltwater: Due to the property being on the island and close to the sea, the water will be saltier than usual. It’s called Saltwater intrusion and naturally occurs in coastal aquifers, including Nusa Penida. You don’t have to worry tho, it’s still safe. ⚠ Electricity: Nusa Penida is a unique island that has an unstable power plant. Power outages can occur at any time during various hours, and this is beyond our control. Guest access This bungalow is located 7 km or 15 minutes drive from Sampalan Port the closest harbor. RECOMMENDED LOCATIONS Attractions: – Goa Giri Temple : 1 min – 100m – Diamond Beach (white-sand and silky blue water bay): 30 min – 12 km. – Crystal Bay (a famous spot for scuba diving and snorkeling.): 49 mins – 23km. – Kelingking Beach (Iconic beach in Penida): 1 hr – 29 km. Eats and Shop: – Warung Forest (Seafood Restaurant): 6 mins drive – 2.1 km – Bohay Beach Bar and Resto: 5 mins drive – 2.3 km – Ocean Blue Bar And Restaurant: 9 mins drive – 3.5 km – The Chill Penida (Beachfront Restaurant with a stunning ocean view): 9 mins drive – 3.8 km Other things to note PAYMENT METHOD We prefer to take reservations on Airbnb. Airbnb accepts the following payment method: Credit Card. If you don’t have a credit card, you can apply for an electronic card issued by banks like Jenius by BTPN (Indonesia) & Digibank by DBS. Book now on Airbnb"
https://www.bukitvista.com/property/sunny-cabin-with-green-lawn-for-big-group-7br,Bright & Sunny Guesthouse with Green Lawn and Pool,Bukit Vista,2 years ago,https://www.airbnb.com/rooms/23364064,"http://maps.google.com/?q=Jl.%20Pantai%20Bingin,%20Pecatu,%20Kuta%20Sel.,%20Kabupaten%20Badung,%20Bali%2080361,%20Indonesia","Jl. Pantai Bingin, Pecatu, Kuta Sel., Kabupaten Badung, Bali, Indonesia",Bali,Bali,80361,Bingin,Indonesia,"Updated on February 24, 2023 at 4:23 pm",PR0057,Start from $920 USD per Month,,,,,Guest House,"Group Friendly Stay, Long Stay Trend Property",2,"NOTE: PRICE VALID UNTIL MARCH 2023 ★ Chosen and managed by BUKIT VISTA ★ A bright and sunny homes reside in Bingin beach village own by the Balinese family who lives next door. Enjoy comfortable location near shops and restaurant, 10 minutes walking distance to the beach, and experience living with true locals. The area includes ☑ Your private bedroom and ensuite bathroom ☑ Working space inside ☑ Shared kitchen & dining area ☑ Spacious green lawn and pool for you to relax after surf. ☑ Wifi speed up to 40Mbps The space ROOM This is a guesthouse consists of 7 rooms, your room is private and bathroom is en-suite. Each bedroom is equipped with an AC, hangers to dry out your towels and a wooden closet where you can store the rest of your clothes during your stay. PUBLIC FACILITIES Common areas like swimming pool, garden, and kitchen are shared with other guest. WIFI You’re probably not going to like this, but we will be as honest as possible about WiFi. We don’t have 100% reliable WiFi in Bali especially during the rainy season, even though we have installed from the best company. The WiFi speed is as you can see in the picture, but we would say that the WiFi works around 40% – 80% only at the moment. We hope you can still enjoy your stay by exploring the neighborhood or discovering Bali’s culture NEARBY LOCATIONS 6 min walk / 450M to The Cashew Tree (cafe/restaurant) 6 min walk / 500M to Bingin Beach 8 min walk / 600M to Casa Asia (Asian restaurant) 8 min walk / 600M to Gooseberry Restaurant 4 min drive / 1.5 km to Ours Uluwatu (restaurant) 6 min drive / 2.2 km to Padang-padang Beach Guest access The room is all yours. This guesthouse is nearby the shores of Bingin beach. Great value for holiday. ✎ Please note that if you want the room to be cleaned everyday with the onsite staff. EXTRA BEDS It is possible but with a nightly price PARKING We have a parking area fit for 3 minibus (elf). Other things to note Let’s use the #bukitvista hashtag for your photo shares on social media. We love to see your happy experiences =) FAQ KITCHEN We do have kitchen that you can use. BREAKFAST The breakfast is not included, but you can arrange it with our onsite team with extra charge, usually, it would be around IDR 50K – IDR 70K/person. SCOOTER AND CAR RENT We can help you to rent a scooter as we have onsite rentals for the scooter. The price varies, but usually, it will be around IDR 80K – IDR 100K/day/scooter. The price would depend on the type of scooter and the length of rentals. As for the car, we could help you to manage that as well, and the price depends on the location that you would like to visit. NEARBY RESTAURANT There would be some restaurant nearby, within the walking distance, such as Latino and Sea Borne. Both restaurants are recommended in Bingin Area. EARLY CHECK-IN Early check-in is subject to the availability of the room, but you usually can arrive early and drop your luggage at the reception area. You can use common facilities or go out first while waiting for your room to be ready (usually around 2 pm). If the room is available, we can proceed the early check in with the extra fee as listed: Early check – in before 14:00 = 25% of the nightly rates Early check – in before 10:00 = 50% of the nightly rates Early check – in before 8:00 = 100% of the nightly rates Please inform us at least 24 hours prior the time you want to do early check in, otherwise we can’t accommodate your early check in. LATE CHECK-OUT Please be informed that our check-out time is at 12noon. Late check-out is subject to availability and might involve extra charge as well. We might not be able to promise any late check-out service at this point however, you may leave the room and pack your luggage by noon time while our onsite team starts cleaning the room. VISIT REGULATION Airbnb policy stated that we can not do a site visit before the booking confirmed for safety reasons. The exact address, direction, and details of the property will be given after you book the property. Book now on Airbnb"
